,Text,oh_label,misspells_count
551,  I strongly suspect that jakew and Robert the Bruce are the same person.   ,0.0,0.013157894736842105
552,"`  == Wikipedia.info redirection? ==  After reading the earlier discussion about the domain wikipedia.info, I visited the domain in question, and got a ``wiki does not exist`` message. When I go to wikipedia.com, I'm ``redirected`` to wikipedia.org.  Why not with wikipedia.info?   `",0.0,0.014134275618374558
553,"Go and read Collectivisation in the USSR, for starters.    ",0.0,0.01694915254237288
554,"    Dear Dogfather, please let me know your opinion about ideas from Wikipedia talk:WikiProject Dog breeds#is: List of dog breeds. Thanks  03:26, 2004 Nov 2 (UTC)",0.0,0.012345679012345678
555,"  Thanks, and I apologize for my comment.  I'd like you to know that I understand your position.   ",0.0,0.0
556,"Okay, there seems to be an 'edit war' going on here, and it's silly.  Question:  is the current photo (colour image) in the Public Domain?  It was not listed as such when I checked.    ",0.0,0.005405405405405406
557," 2004 (UTC)  :I don't see how a person with such strange opinions could be qualified as a mediator for anything. You seem better qualified for asking me if I want fries with that.  -  18:46, 17 Nov",0.0,0.0
558,"  :Nice one. If you're an ex-Wikipedian, couldn't you have inserted a few more links? -)  |  ",0.0,0.010752688172043012
559,Did the Libyan Islamic Fighting Group ever use system flowcharts,0.0,0.0
560,"`  :If you can find any references to support the claim that there are actually vampire hunters who attempt to hunt and kill members of the vampire subculture, feel free to add that section back in.  I couldn't find anything to support it, and the claim that ``any vampire is capable of killing any human with little effort`` is contradicted by the majority of sites on the subject.  I fail to see how one edit over two months ago is ``continued butchering``.  - `",0.0,0.0
561,Talk:Khmer Rouge/Archive 1 Talk:Khmer Rouge/Archive 2 Talk:Khmer Rouge/Archive 3,0.0,0.0
562," 2004 (UTC) ::When I was in Cuba I came over a central bureau of propaganda material. I think I took a photo of it. I'll check. -  08:18, 19 Nov",0.0,0.0
563,"`  == Can we get a geography section in this article? ==  For instance, New England apparently has fjords known as ``fiards``.   `",0.0,0.007692307692307693
564," :Meet-space refers to the real, rather than virtual, world.  The sentance means that actual physical police went to some spammer's house and arrested him.  I've chaned it in the article.  ",0.0,0.010582010582010581
565,"` ::Right... I tried to follow the tutorial, I think it'll basically work in 5.5. It's ``extrahera``, not a command I'd ever have selected sponaneously in my life. I think I'll be able to do it, although tonight, I've been spending a lot of time without tangible results. The tool is kind of too intelligent for what I tried to do. I outlined the part I wanted with green and filled inside with blue, but then Photoshop tried to guess (quite wrongly) what I really wanted and kept big blurry bits of the green-covered stuff, too. -( Computers are just too smart these days. Anyway, I made progress, I'll probably get there another day. Thanks, David. ]] `",0.0,0.004580152671755725
566,   ==sweet== this game looks so freakin sweet i hope my dad buys it for me,0.0,0.013513513513513514
567,"  :Ach! I've known more Karl's (and Carl's) than Kurts, I reckon. My apologies! Cheers,  |  ",0.0,0.021739130434782608
568,"`Text from parallel article Anthony Ashley Cooper, 9th Earl of Shaftesbury, reformatted to wrap properly but with typos intact. This reads like an old article from The Children's Encyclopedia, but I don't know if that's where it came from:   Piccadilly Circus is the centre of London where many streets meet. In the middle of the Piccadilly there is a small island of stone, and on the island there is a statue called Eros. Eros holds a bow and arrow, and leans forward as if he is flying over London.On the steps below him women used to sit with baskets of violets and snowdrops, or bunches of pink carnations and tight little rosebuds.  All around are buses and lorries, and taxis and cars coming from north and south and east and west.Day and night the busy London traffic swirls round the small, stone island, and day after day people hurry past on their way to shops and theatres and staions and offices.  Everyone knowws Eros. Taxi drivers look up at him and say,  ``Ah,Eros!Here we are at Piccadilly!``  CHildren, holding tightly to their mothers' hands as they cross the road, try to catch a gimpse of him between the rows of traffic. But no one seems to have time to go up the steps, and read the words that are written below the statue. Many people, though they know Eros so well, don't know at all why he is there.  He is there to remind them opf a story about a man called the Earl of Shaftesbury, who spent his hole life heping children.`",0.0,0.006202618883528601
569,"`== Condoleezza Rice censorship == Hello Jewbacca. I am writing to inform you that I have some issues with your edits to my contribution to the Condoleezza Rice article. Although you claim that I ``poison the well with unneeded POV implications,`` I would argue that your ambitious language leaves too much open for interpretation and lets Dr. Rice off the hook. Having a NPOV doesn't mean censoring controversial ideas. For example, you removed ``criticized`` from the line ``Rice became the first National Security Advisor to campaign for her boss...`` You make it sound like perhaps it is a good thing that She was out stumping for Bush instead of protecting the homeland. In addition, you removed another line I added that spelt out that there is a ``controversial`` link she perpetuates between Iraq and September 11th. The fact that this is even open for interpretation is beyond me. I believe my additions were in line with the NPOV policy and I have replaced them. It concludes with the actual quote so readers can pose their own stance. I am open to suggestions of maybe a better way to word my feelings on this topic. Please let me know.    `",0.0,0.006944444444444444
570,"  ::: I don’t think I am saying anything more than I have explicitly stated above. When we have the Homeopathy article explaining every single concept and aspect of homeopathy, except for only two short and simple definitions explained somewhere else, both of which can be written as single paragraphs, which are both referenced only in one paragraph of the main Homeopathy article, then it seems rather obvious that those paragraphs should be included in the main article itself. Note that besides the List of homeopathic remedies there are only two articles with “homeopathic” in the title: Homeopathic repertory and Homeopathic proving. Every other concept is explained in Homeopathy. Their what links here pages show that they are needed for only one purpose: to explain one paragraph of Homeopathy article, the first paragraph of Homeopathic remedies section. But I think I’m repeating myself.  ",0.0,0.0
571,"  ==Revert without comment== Please don't do that - if you disagree with an edit, please discuss it on the talk page, thank you,  ",0.0,0.0
572, :  's suggestion elsewhere of a disambiguation block prefacing the CORBA page seems like the best of both worlds to resolve this.,0.0,0.007692307692307693
573,Ununhexium Delete - more duplicative speculative sciencecruft. The article admits that evidence for this is fabricated and that its main role is in ufo conspiricy.  ,0.0,0.030303030303030304
574," *Possibly it justifies a redirect to Elements that do not exist, or Fictional elements, but we don't have to indulge people who make up new elements and are then found to be crooked.  ",0.0,0.0
575,"  == Please do not abuse vfd process ==  There is a process of community voting, your lone-rangerism is not appreciated.  ",0.0,0.01639344262295082
576,"If you want an article kept, then vote for it, don't abuse the process. Thank you. ",0.0,0.0
577,"  == Peloponesian War - good, but maybe move to another page? ==  I don't have a strong view, and I'm not sure which way is wikkiest, but I think the diversion into the history of a campaign lost through the disease might do at least as well on its own - as a side bar, diversion or further layer of detail. Opinions?",0.0,0.006309148264984227
578,  == VFD process abuse ==  Listing things which should be deleted is not abuse. Removing things without following process is.  ,0.0,0.007874015748031496
579,  :Herschel has now been blocked.  See Wikipedia_talk:Requests_for_arbitration/Admin_enforcement_requested.  That should make life a little easier.  ,0.0,0.0
580,"  :: I agree with the house policy. The first time a ship is mentioned it's USS Shipname, after that it's common to refer to her by her name, and often her nickname. If were are talking about something formal, then you revert to USS Shipname. Also the title of the article correct, but the text is not. A ship's class never starts with USS. The USS is a formal designator meant to show commissioned US Navy ships. This is the second time I have seen this done on Wiki. The first time was with the midget submarine X-1 which was never commissioned (the CNO would never let something like that get commissioned because it counts against his total ship count). ",0.0,0.004559270516717325
581," ::::Thanks for the information.  I obviously know very little about LDS, but I am willing to learn more.  ",0.0,0.009345794392523364
582,  I.Kant believe how sad everybody who writes things on this sight are- get a life!  ,0.0,0.0
583,"  I listed the article at cleanup because I think there is good content there, but it needs to be cleaned up.  At the first read, I immediatly got the impression that the article was written by a fan, and that the text didn't flow as well as it could because too much detail and too many quotes of more or less relavancy were included in the narative.  You seem to resist the editing of the article by others, reverting the article atleast 6 times in the last two hours.  This is not constructive.  If others choose to edit an article, it is because they want to make the article better, either by adding more detail, or by making the existing detail easier to find or understand.  We're all here to build a better encyclopedia, and sometimes a better encyclopedia is built by tightening up content so that it is presented in a clearer, more consise manner.  The best content in the world is of no value to anyone if the reader never finds it because it is surrounded by too much fluff.  ",0.0,0.005060728744939271
584,"`  :Yo, i started checking Shakespearian authorship, when i thought, ``hang on, by the time i finish checking this, someone will probably have edited it``, So i propose that we use the form:  Article (The bellman checked -  and also leave a note on the talk page saying, ``This page has been reviewed and judged to be ready to be saved in static form as part of the William Shakespeare WikiReader. If you believe that the version of this page which was checked (), is not suitable for static reproduction, please raise your concerns on this talk page.  This makes sure we dont miss some error which is discovered between now and when we finish the wikireader, that we know what we checked, and it also helps publicise it a bit aswell (which can only be a good thing) 06:23, 2004 Nov 27 (UTC)`",0.0,0.006313131313131313
585,"  :I may have left in '86 but my parents still live in the same house. Since you're in the area why don't you go and check - I haven't been up there for about 18 months so things may have been cleaned up, but it didn't look too hopeful since it has been in that state for at least the last ten years. I'd check myself but I actually reside in Australia, so a quick trip is not really feasible right now. If I'm wrong I'll be more than happy to retract my statement, but since the problems appear to be somewhat entrenched, I'm not too hopeful. The area I'm thinking of in particular is the section of Livingstone Walk between Henry Wells Square and the main residential section - there was a major park there that is now closed and unquestionably surrounded by barbed wire. Further on is The Dell which when I visited last was strewn with houshold rubbish and used syringes. I don't think the evidence of my own eyes counts as 'POV'. As for the implication that I might simply be lying about this - why would I want to do that? These places are not the only examples - a tour of the area on foot will confirm what I'm suggesting. As for the CCTV info, it may be true, but it isn't actually very interesting, nor is it worded in a way which makes much sense. Read the sentence again - it does not tell you anything unless you already know what it's meant to be saying. If it can be reworded to say something interesting it might be worth keeping. (Since the UK now seems to be infested with surveillance systems, I don't think that singling Hemel out is really worth a mention). ",0.0,0.0019011406844106464
586,"`  :Let me explain the problems in your paragraph, which for ease of reference I include below.  ::Prime Minister Blair is known in Britain as well as the United States for his personal closeness to US President Bush. The two's coordination is uncanny, rarely ever voicing direct disagreements and presenting united stances on most issues; sometimes with Blair going against the Labour party as well as the majority of British citizens. In May, he backed the controversial Israeli withdrawal plan for the Gaza Strip, a radical departure from traditional British politics toward the region, and a move that put the British government in the position of being the only major nation besides the US to support it. He acquiesced to American requests in October to send Scotland's prestigious Black Watch battalion to Baghdad. Recently, the Prime Minister responded to a question on the environment with a stance very close to what the President Bush's was. This ``special relationship`` between George W. Bush and Tony Blair has drawn a mixed bag of reactions in the UK, but it continues to be strong. In November 2004, the Prime Minister travelled to Washington in hopes of using the close friendship to influence the President's stances on a European summit, environment/climate control, and an Israeli-Palestinian peace plan.  :The first sentence is acceptable and is in the article. The second is where the problems start. ``The two's coordination is uncanny`` is the sort of statement one would make about two lovers, and will carry this meaning to readers. As for ``rarely ever voicing direct disagreements``, you will find this in most public utterances in diplomacy, regardless of any actual disagreements. For example read the press conference with Blair and Chirac earlier this month. The issue of dissent within the Labour Party over Blair has already been covered in the article and needs no repeating here.  :The UK government's support for the Gaza withdrawal plan is hardly ``a radical departure`` and, even if it was such a statement would be POV. See 'The Chariot of Israel' by Harold Wilson for the full story of British support for Israel over the years to 1981. Also, the Israeli Labour Party has supported it, and that carries weight in its British sister party. Then the use of the term 'acquiesced' which is only used in a subservient relationship and is therefore pejorative, as is the insertion of 'prestigious' before the regiment: this reads as if it magnifies any offence because the regiment involved was more distinguished than others.   :The remark about the environment lacks any detail but is irrelevant: the UK government policy hasn't changed and is quite distinct from the US, so anything which Blair might have said at a press conference is neither here nor there. Finally we come to a report of Blair's visit to the US which states that it was about the environment (it wasn't - see press conference) and is imprecise. This issue, and the rest of this edit, is better covered in the article as it was, and I have therefore reverted it.  `",0.0,0.0019537609899055682
587,  ==Foundation Issues==  Can be found here   ,0.0,0.0
588,"`  ==Video Poker==  Video Poker machine payout tables only represent a theoretical payout percentage. The vast majority of gamers cannot achieve that payout percentage because they do not play correctly.  It is essential to draw correctly depending on the content of each dealt hand, and there are strategy tables devised by computer which determine how to do so, depending on the payout table. (Hence you need different strategy tables for different payout tables!)  My ambition is to add such strategy tables to the Video Poker article, but I can't just copy-and-paste such strategies from an existing book due to copyright. To get around that problem, I have an off-the-shelf analytical program that allows the creation of strategy tables based on a weighting of difficulty vs. accuracy. These tables are slightly different than the published ones, but still accomplish the desired positive payoff.  If you're interested in getting a good feel for this, there is a training program called ``WinPoker`` available from Zamzow Software, (in the U.S.), that allows you to practice, as well as automatically run through a great number of hands using a given payout table and strategy.  Cheers,   `",0.0,0.0016736401673640166
589,"34, 30 Nov 2004 (UTC)  ::Because you like to accuse me of reverting, when in fact this seems to be your modus operandi. Also, I don't beleive that Shorne is a troll any more than I beleive you are a troll. -    ::: I have added responses to the above.  This is a tu quoque argument.  Just because I've reverted vandals and trolls does not mean you do not revert as well.    ::::Then I suggest you look at the reasons for my reverts. I have each time: taken the page to talk. have tried to compromise your reversions. Only reverted you because you reverted yourself, in most cases losing information. Allow my to continue the history log a bit later. Then we'll see. -    ::: And I'm guessing you're not expert on Shorne, so what you think probably shouldn't have much weight.  01:",1.0,0.010256410256410256
590,"`   ``For some Christians, Mary was believed to have been the same woman that Jesus had rescued from being stoned to death. However most modern scholars believe that the prostitute Jesus rescued and Mary were two seperate persons. However the Mel Gibson movie The Passion of the Christ had portrayed the prostitute and Mary as the same person.`` Is this ``prostitute`` the woman taken in adultery? Some Christians have historically been discouraged from reading Scripture on their own: could this still be true among some sects?  `",0.0,0.0018832391713747645
591,", and many probably do just that.  I believe this would save a great deal amount of time, as well. ",0.0,0.0
592,"`   ::I agree the text is poor but for starters it's better than nothing, there would be no point to the article otherwise.  We should add back the cleanup tag perhaps.  An Encyclopedia is allowed to be a ``how to`` guide for do it yourselfers?  ``Common sense rules`` as a heading probably should be changed to something more like ``Tenets of regional planning`` or something more encyclopedic sounding, I agree.  `",0.0,0.002403846153846154
593,"You need to learn all 4 cause Japan and Korea used to write in Chinese, also Chinese references to these countries can not be ignored especially when these countries did not compile massive ancient historical information like the Chinese did. Also, there are proof, evidence, documentation in Korean, Japanese and Chinese, in addition to counter arguements for many disputed items. And you need to know english cause this is an english website.   ",0.0,0.0022371364653243847
594,will make the change to create a strong AI heading for the article if no one responds,0.0,0.0
595, It's an unreasonable claim drawn up by conspiracy theorists with no better use for their time. ,0.0,0.0
596,"  == RfC ==  I have added the diffs, and an explanation as to why you might have arrived at that misaprehension.    Wikipedia:Requests for comment/Slrubenstein",0.0,0.018867924528301886
597,"`  == One Addition ==  Mustafaa, I promised much more stuff but have been too busy lately. One thing that sticks out and could be fixed quickly is the beginning of the invasion. Yes, it is my fault for adding only the Argov incident, which now makes it sounds as if it was the main reason for invasion, which is of course wrong. So, the sentence: * ``On 1982-06-06 Israel invaded Lebanon in response to the attempted assassination of Israeli Ambassador Shlomo Argov by Abu Nidal in London on June 4.`` should be expanded. This is a quickie list of basic facts: * Israel had been bombing Lebanon/PLO for months, from the air, sea and land; and preparing for the invasion (see below, they couldn't have pulled of the invasion in a matter of days otherwise.) * There was the attempted assassination Shlomo Argov ... * The assassination attempt was used by Begin as an impetus to shortcut the Knesset's debate and move into Lebanon without full approval.  * Israel invaded with 60,000 troops.  I'll post links and add more explanations if needed.   08:56, 2004 Dec 2 (UTC)`",0.0,0.007483629560336763
598,"`=Edits made=== Let's discuss them here.  My first change is to the first sentence. I have changed: ``The United States has an established legal tradition of providing strong protection for civil rights and human rights.`` to ``Although the United States has had instances in the past where it has infringed the human and civil rights of people, it has established a legal tradition of providing strong protection for those rights.`` See #My markings up of ``dubious`` for why this was marked as disputed. I have tried a compromise. -    ==`",0.0,0.0
599,  ==Talk:Christmas== The commercialization of Christmas has been mentioned there by . You can make reply to this part. Click here.,0.0,0.0
600,"Macroevolution theorizes that there is a common ancestor to all vertebrates. The test is that if this were true all vertebrates would share similarities. Since it upholds to this test, all vertebrate are similar it gains support as a theory. You claim to be friends with science. That is how science works. If a theory upholds to tests and gives consistent results, it gains support.    ",0.0,0.002583979328165375
601,"  == hello dan! ==  i am esther and i from spain,i have curly hear and i dont like the chocolat, but i like gominols. i love your films and i think you are excellent!, i dont like boys to his hear is fair,but i like the boys to his hear is black. i sinpatic but i dont talk very good spanish, sorry, jajajja. PLEASE, CONTEST ME! THANK YOU! ESTHER FUENTES,  PDS:I´VE GOT 13 YEARS OLD. GOOD BAY!",0.0,0.03307888040712468
602,"`  == Info and links == * The Cause for Invasion :``The goal was to remake the political landscape—to drive out the Palestine Liberation Organization and install a right-wing Christian Lebanese leader prepared to sign a peace deal with Israel. But Operation Peace for Galilee ended in failure.``   :``Israel launched operation ``Peace for Galilee`` and invaded Lebanon in 1982 in what was sold to the Israeli public as a bid to drive the Palestine Liberation Organization back from the northern border. Sharon went on to drive the PLO out of Lebanon and to try to install a more friendly regime there. ... The Israelis stayed, and their effort to install a new regime ended in disaster.``   * The Invasion was planned :``When, in early June 1982, terrorists of the Abu Nidal organization, a PLO splinter group, badly wounded the Israeli ambassador in London during an assassination attempt, Israel seized the pretext for launching its long-planned offensive.``   * The Invasion was opposed by the US and the UN: :* See ``U.N. Security Council Resolution 509`` :*``On June 6, President Reagan, in France to meet with the G-7 Heads of Government at the Versailles Economic Summit, dispatched Habib to Israel to try to restore the cease-fire. That same day the United States joined a unanimous U.N. Security Council Resolution demanding that Israel withdraw from Lebanon and that the border cease-fire be observed by all parties.``   * Other details: :``September 15, 1982: Ariel Sharon arrives in Beirut to personally direct the IDF campaign ... The IDF launches sporadic shellfire at Sabra and Shatila.``   :``September 15, 1982: An Israeli divisional intelligence officer, providing an update briefing on the situation in the camps, reports to the Chief of Staff: ``It seems there are no terrorists there, in the camp; Sabra camp is empty.`` (Kahan Commission Final Report, p. 24).  :``Two Israeli paratroopers tell correspondent Michael Gerti: On Thursday evening, as darkness fell, Palestinian women from Shatila arrived at the post and hysterically told us that the Phalangists were shooting their children and putting the men in trucks. I reported this to my commander, but all he said was: 'It is okay, do not worry.' My order was to tell the women to go back home. However, many women, and entire families as well, ran away from the camps to the north. I went back and repeated my report over and over. Each time, however, the answer was the same: ``It is okay.``...It was possible to stop the massacre in Shatila, even on Thursday; had they acted on what we reported to our commander. (Ha'aretz, September 23, 1982).``   05:25, 2004 Dec 3 (UTC)`",0.0,0.004524886877828055
603,"`What about the PA32-260 and PA32-300 models in the late 60's and early 70's?  They, too, were called ``Cherokee 6's``.`",0.0,0.0
604,"Italian, French, some Arabic and a bit of Maltese.",0.0,0.0
605,Sorry that was a typo on my part. I meant to say Trademark.  .  ,0.0,0.0
