,Text,oh_label,misspells_count
274,"I just changed the logotype by uploading ATI_Logo_0903.png If I should rather have deleted existing ATI logo.png and replaced it with the new image, say so (or just fix it). As it is, there are two ATi logo images on Wikipedia, one of which no longer matches the official one (and it had that ugly placement of (r) anyway).",0.0,0.015479876160990712
275,"` :::Actually, John, I didn't complain about the color at all. -)  I do think, though, that if someone feels a color is unattractive, saying ``we needed to choose a unique color and we did`` isn't really addressing the issue  although I think you're right that infoboxes are generally ugly.  Their usefulness needs to outweigh their aesthetic drawbacks, and I think yours has, in this case.  Theresa is free to disagree with me, of course.  Aggressive editing (hmm, that sounds hostile....is it supposed to?  Bold editing, though, is encouraged, and probably amounts to the same thing) sounds intriguingly vague.  And I'm not trying to bog you down (what do you mean by ``science kook``?  Hopefully not me)  if Irismeister wants to answer my question about interpolations, I think that makes the most sense.  You'd indicated that you were going to edit the article for Dr. Jipa and I wanted to make sure we were being careful with verifiable and sourced information, but perhaps your comment indicates you've changed your mind?  Anyhow, I think you're right on the color.  `",0.0,0.002793296089385475
276,"`Sodium,  While I generally like this well fleshed-out article I must point out some inconsistencies and present my reservations and remarks.  ``For lay people or for academics`` - this issue has not been tackled properly by Wikipedia community yet. It seems to be really hard to strike a balance between these two approaches. Obviously I am looking at this article from the professional's perspective and I feel the article is lacking something.  There is another thing, in the last decades medicine has changed considerably. Evidence-based medicine, large international studies and meta-analyses pave the way for everyday practice. We no longer take medical standards and medical knowledge for granted it must be well researched and put under scrutiny of double-blind randomised studies. A statement is never complete without references from respected peer-reviewed medical journals. Considering this health science articles seem incomplete or even sound like the medical knowledge of the past.  # ``present in cigarettes`` - better ``in cigarette smoke`` or better still - ``in tobacco smoke`` # ``lung cancer`` - ``lung neoplasm`` - ``lung tumour``  these can not always be used interchangably and can be misleading sometimes # ``cells lining the bronchi`` - bronchial mucous membrane (consider changing in some places ``cells`` into ``tissue``) # ``patient here would start to cough up blood-stained material`` -it is unclear because of cancer or abscess # histology of lung neoplasms  asbestos is carcinogenic in case of mesothelioma mainly AFAIR # treatment section needs more material # all in all this article needs some rewrite and probably should fork into several other articles about specific histological types of neoplasms - they are diferrent in many respects. A good job but let's combine our efforts to make it even better. Kpjas `",0.0,0.0037858301784748512
277,"`  :::Utah ``War`` is a misnomer; it's more like the ``Utah standoff``.  AFAIK, there were no casualties resulting from the few engagements between the Mormons and the US Army. War crime? That's getting too ananchronistic, don't you think? MMM is not a war crime. Lee was convicted in civilian court, not a courts-martial. —| `",0.0,0.0061162079510703364
278,"`**Puritan yes – dumb no, not except for in your rhetoric above. Since I was 17 and started full-time apprenticeship, I admit to have studied the foreign language of the country where I live in any way resembling school. ``Intellectual`` - just the right accusation to throw at me! Common Americans being more ignorant of their country's foreign politics than the electorates of other democracies, that's a fact. The arguments are very well presented by plenty of others. There is no need to repeat those. I added what I hold for the most important, i.e. that of Wikipedia's credibility (outside of the US).   #`",0.0,0.0
279,"  ::::I've got to say, before I begin, that I've been trying to stay out of this spat, and that if anything, I've been in agreement with Julie. That said, I'm with AlexR on this one. This suggestion that the numbers are about equal with transwomen is, I must say, new to me. From both personal experience and extensive reading, just about everything I have ever encountered on the subject has suggested that the ratio is about 1:1. The same would be reflected in those I have known personally over the years.  ",0.0,0.00392156862745098
280," ==Hellfire Club== Sorry R, my knowledge of things related to the Hellfire Club is shockingly minimal.  ",0.0,0.0
281,Here we have you admitting a lower cost than you will allow in the article:  Make the reliability point in the article if you will.  But it seems you are not being consistent.     ,0.0,0.0
282,"  Your  are great. Have you thought about advertising them some more, such as on the scripting requests page, and possibly moving them into the Wikipedia namespace?  ",0.0,0.006024096385542169
283,"`  ::It's not the wording or whether it's okay, so much as the question of whether the choice is really supposed to be random, and if it's not then the article shouldn't say that it is. When a contestant chooses 50:50 in the American version, Regis says, ``Computer, please take away two answers, leaving one wrong answer and the correct one.`` So I'm not certain it's really random, so I'm going to remove that one word from the article.  `",0.0,0.0
284,Please don't call people names.  And your inclusion of all of those pictures on the Laura Bush page is excessive.  ''' ,0.0,0.0
285,"  ::This is rather unfortunate, since I'm feeling like we just got to a point where we agree with each other.  By the time you get back, I'll be gone, pretty much for the summer.  I'm going to look around for some hardcore denier websites (although I hate to give them the traffic) and post them here soon, although it's shaping up to be a busy weekend.  As for making a seperate revisionist page, I was very much in favour of it, but didn't have the time to write it before it got deleted.  There had been a revert war, and people pretty much decided that it would be better just to cover both here.  I would encourage you to write one on your user page and getting approval before posting it, otherwise some of the hardliners are likely to get all angsty on you.  Good luck!   ",0.0,0.0038510911424903724
286,"`Postgres  After returning to Berkeley, Stonebraker started a post-Ingres project to address the problems with the relational database model that had become increasing clear during the early 1980s. Primary among these was the relational model's inability to understand ``types``, combination of simpler data that make up a single unit. Today we typically refer to these as objects.   ``...the problems with the relational database model`` - I do not believe this was the case, there was no problem other than ignorance of the fundamentals.  ``Primary among these was the relational model's inability to understand ``types``...`` - complete rubbish, should be removed.  Replace with this para:   == Postgres ==   After returning to Berkeley, Stonebraker started a post-Ingres project to address limitations of existing database management implementations.`",0.0,0.004678362573099415
287,"`I was sad to see that you're going to be away for the next week, because as you're coming back, I will be leaving for the summer after that.  I want you to know that despite our disagreements, I really appreciate what you're trying to do.  It's difficult for most people to write a truly NPOV article, which is why what Wikipedia does is so great.  By having hundreds of thousands of authors, almost every point of view is represented, and people are forced to compromise, usually resulting in pure truth.    Unfortunately, the Holocaust is one of the few subjects where this doesn't work.  It is a subject which should be purely history.  The Nazis kept spectacular notes on everything that they did, and it should be spectacularly easy to say ``this here is exactly what happened.  We know, because of the monthly reports written by Himmler.``  Unfortunately, Holocaust deniers continually show up, most of whom have no interest in truth or even compromise.  They tend to wipe entire paragraphs, and replace them with their own propaganda.  This is just who they are.  They cannot provide evidence as convincing a page from Hitler's desk ordering the final solution to ``The Jewish Problem`` so they don't listen or compromise and eventually leave in a bad mood.  At the same time, I can't exactly claim to be NPOV either.  It is fairly clear from what I have already written here that I hold Holocaust deniers in no high esteem.  Quite frankly, I find their so called ``beliefs`` to be an attack against me and my people.  It is, to me, like someone claiming there was never racial segregation in the United States, and that even if there was, the slave owners didn't know their slaves were being beaten.  It would be an absolutely ridiculous claim, and yet people get away with it in reference to the Jews.    It is good, therefore, that someone has shown up who is interested in this issue, but who has no real stake in the argument.  I would caution you, however, against being overly zealous in your changes.  Holocaust deniers are, by and large, anti-Semitic.  My personal favourite group believes that Jews are shape shifting lizards from Mars who are infiltrating the world governments in order to enslave humanity.  And yes, this group has a following.  The ``Holocaust Revisionist`` lines and the ``Jewish persecution was wrong`` lines are simply ways of attracting new followers who can then be trained to believe just about anything once they've got their foot in the door.  The people running these groups are solely occupied with promoting anti-Semitism in the hopes that some day they can finish off what Hitler started.  I encourage you to write carefully about what they believe, but please don't be fooled by them.  I wish you the best of luck.   `",0.0,0.0010834236186348862
288,"`Thanks Rb,   I have indeed read that, the whole point of me defending these two main points.. nick mason and places of interest is that i DO believe them to be extremely relevent to the page, Andy is definately ``bold in updating pages`` and thats great but without other peoples hard work to update there wouldn't be any updating to do, infact this place wopuld be rather empty. Andy is very bold in deleting work that in my opinion shouldn't be deleted and especially without discussion first. I have suggested a vote because to get mediation etc really is a last resort.  Nick  `",0.0,0.008576329331046312
289,"  Romanian is very different from Dalmatian, so they probably developed in distant regions. This suggests that Romanians could not have come from the western part of the Balkans (including Albania). - I think that this argument should be entirely removed as it definitelly is not argument against theory of migration from south, but barely from Dalmatia (nobody claims that Vlachs arrived from Dalmatia). It is just irrelevant. On the same basis Dalamiatian could be replaced by Italian. ",0.0,0.006147540983606557
290,e.g. the visits to Nazi concentration camps in WWII?,0.0,0.0
291,"Is this battle the same as Battle of Kadesh ?   07:50, 2004 Jun 1 (UTC)",0.0,0.014084507042253521
292,  lol Rita Guerra is a prominent person? this must be some kind of joke,0.0,0.014084507042253521
293,     view - talk -  edit ,0.0,0.0
294,"`===Plautus satire's irresponsible comments are those of a crackpot.===  Plautus satire's comments are idiotic nonsense. I have refereed papers for five mathematics journals, and my published papers have been refereed (and some unpublished ones that I submitted). Obviously history is consulted; obviously proof-checking is not the main point of refereeing; obviously novel ideas are examined in the context of accepted notions. To say that mathematics is not a science but a ``language`` ignores the fact that hundreds of journals are devoted to publishing new discoveries in mathematics. Obviously in judging publication-worthiness one considers how new discoveries may be relevant to potential future research; one considers esthetics (which for most mathematicians is the main motive for doing mathematics or for learning mathematics). Whence this loony idea that there is no need to consult history? Do you not see sections on how a new discovery fits into the historical development of the subject in many research papers in mathematics?  Plautus satire's comments are those of a crackpot.    `",0.0,0.0
295,"`  ==Brianism== I do not know if you are watching Brianism Talk, but it is fair that you should see this: An Open Letter from Rex Mundi, co-founder of Brianism.  In view of this, I have changed my vote to Delete. Link has apparently been ``e-mailed to participants in the discussion``, but not posted on WP by the writer - which is why I am doing it. I also do not see how the writer would have all the e-mail addresses involved. Kind regards,  `",0.0,0.008968609865470852
296,"   == Ballet ==  Hi,   I'd like to ask you to contribute to the Glossary of ballet terms. It is so poor now.  ",0.0,0.0
297,"Hello, and welcome to Wikipedia! Nice job on Danderyd and  Djursholm. Good job also on the uploaded images Image:Djursholmsslott.png and Image:Djursholmskapell.png, however photographs should be uploaded in JPEG format in order to conserve space. Re-uploading them in the correct format will reduce them to about a tenth of their current size. If you have any general questions you should also feel free to visit the Village pump. Cheers!     ",0.0,0.013544018058690745
298,"Please stop vandalising or you will be blocked from Wikipedia.     This is the discussion page for an anonymous user who has not created an account yet or who does not use it. We therefore have to use the numerical IP address to identify him/her. Such an IP address can be shared by several users. If you are an anonymous user and feel that irrelevant comments have been directed at you, please create an account or log in to avoid future confusion with other anonymous users. ",0.0,0.0020964360587002098
299,"   This is the discussion page for an anonymous user who has not created an account yet or who does not use it. We therefore have to use the numerical IP address to identify him/her. Such an IP address can be shared by several users. If you are an anonymous user and feel that irrelevant comments have been directed at you, please create an account or log in to avoid future confusion with other anonymous users. ",0.0,0.0
300,"  :One soul can direct ALL his mindjob to another one, who will feel this in his dreams. You just have to think to another one (for example: think (say) the words of your thinking to another certain soul whom you want to think it). You to not even have to know the name of the target person, instead you just have to know that (s)he is. )  ",0.0,0.0029411764705882353
301,"`  :The relevant quote is here: ``When I first began tinkering with a software program that eventually gave rise to the idea of the World Wide Web, I named it Enquire, short for Enquire Within upon Everything, a musty old book of Victorian advice I noticed as a child in my parents' house outside London. With its title suggestive of magic, the book served as a portal to a world of information, everything from how to remove clothing stains to tips on investing money. Not a perfect analogy for the Web, but a primitive starting point.``   `",0.0,0.0036900369003690036
302,"  ==Protection==  Very few sysops have protected their user pages. I recommend you read m:Protected pages considered harmful before you consider doing this. My personal view if that sysops should not have the right to protect their user page when ordinary users can not. Adminship is supposed to be about protecting Wikipedia, not just your own pages. As far as your templates go, if you want to protect them, why not move them to your own user space? The new version of the software allows inclusion from other namespaces. For example, {{subst:User talk:Angela}} on any page would display the current version of my talk page there.  ",0.0,0.00473186119873817
303,"No indication of where in the world this is. Spelling of article title doesn't match spelling in article text. Is this a place there is already another article about? If so, merge.   ",0.0,0.0
304," 11:00, 2004 Jun 11 (UTC)",0.0,0.0
305,"  : Other people sometimes have a different screen resolution, font size, and/or browser than you. — The image was previously 350 pixels wide. The TOC is approximately that same width, at least in my font size. That makes 700 pixels. How is that and the sidebar supposed to fit on a 800x600 resultion? —  ",0.0,0.006557377049180328
306,", where Ploticus does not render to PNG",0.0,0.05128205128205128
307,  Hi - per the Wikipedia:Manual of Style we start headers at == and we work down from there. I know it can look a bit big but that's how it's done ) Thanks  ,0.0,0.0
308,"`   Hi Euric - welcome to Wikipedia. About your recent edits to Floppy disk: Metric specifications are no 1 worldwide now, agreed. But that's not the point here. It's a fact that these floppies have been called 5¼- and 3½-inch and that has to be seen in a historical perspective. The fact that the 3½-disk is actually 90 mm in size has also been clearly stated in the article. (It might have been called a ``90 disk`` or something similar, if it was invented 10 years from now ) And even when using the metric system, you'll sometimes run into ``misnomers``; if you bought a 2½-litre car it is highly likely that it sports an engine with only 2,4895 litres of displacement.  07:36, 2004 May 21 (UTC) `",0.0,0.0042796005706134095
309,"  :While I don't feel the paragraph is out of line, I'd say just edit in the basic facts and edit out the farcical statements. Statements as to why a pope didn't have a coronation belong in HIS article. If the removal of the tiara at 2nd vatican council doesn't impact it's modern use, don't mention it. Just state that tiaras weren't used with these popes as they entered the papcy by installation, not coronation, but Church Law indicates that use of the tiara and future popes' coronations are expected. : ",0.0,0.005893909626719057
310,"  == Empty Friends plots == I think I put stub notes on those pages, are these not sufficient? The incomplete pages are definately works in progress. Would it be safer just to disable the links until I am ready to totally complete the article?",0.0,0.00411522633744856
311,"  :I'd say you like Nintendo too much. ;)  :It's a good idea, now I think about it. I've been trying to think back to when bosses became popular (a mite difficult seeing as I would have been about five years old), and it seems that the flash point is in 1985.  :However, I am quite heavily biased toward scrolling shooters, so I'm probably missing something important. Bosses are, on the other hand, probably more important in scrolling shooters than any other genre, because they have to break up the linearity of the game.  :Anyway. In 1985, you've that Mario game thingy, and Gradius, which is the first time I can recall having to fight a huge boss character. Then in 1986 you've got Darius, which is the earliest game I know of that had different bosses for every level. I think it had minibosses too.  :And then it really gets going. In 1987, I can name R-Type, Raiden, and Rainbow Islands as having distinct bosses, and by this point it was all pretty standard. But I'm just namedropping (and article-dropping too, seeing as I wrote most of those articles ;) ). The point is that there seems to be a dark age of bosses before 1985, so it would probably be interesting to unravel that.  :The very earliest enemy-that-could-conceivably-be-thought-of-as-a-boss that I can think of (not including that Dungeons and Dragons thing mentioned in the article, which I know nothing about) is the Flag Ship from Gorf, an arcade game released in 1981, in the prime of the Space Invaders Era. Gorf was like five games in one, and when the player completed a level, they would move onto a level in the next game.  :The fifth level was a battle with the Flag Ship. It has all the hallmarks of a boss: It's much bigger than the player's ship, much better armed, has its own forcefield, and is only minorly damaged by the player's weapon. The only way to destroy it is to hit it in its weak spot - a reactor situated deep within the ship.  :Now I think about it, I don't know why I didn't mention this before. The thing is, I always thought of the Flag Ship as a 'level' rather than a boss. There wasn't really any concept of a boss at that point in history. Still, it's a start.  ",0.0,0.0032243205895900505
312,"` (UTC) ::A car can't, but ``event of car hitting dog`` can be figuratively merciful to someone being chased by a rabid dog | 03:25, 16 Jun 2004`",0.0,0.0
313,"`  == IPA - what ==  I read the main page of the article on IPA. On the plus side it is clear. On the minus side, it makes no attempt to explain what the IPA is.  (context, scope, purpose, etc.) Nice chart.  Lots of data (for people who probably have no need of it) but virtually no general information. My questions (which weren't answered - keep in mind I'm a totally lay person): An alphabet is used to 1.  Communicate between a writer and a reader (of the same language), 2.  Describe that communication (unambigously?)  Right?  Certain things are implied by its name, but clearly one should define what the subject of the alphabet is (are).  I have no idea if it covers all indoeuropean languages not to mention Mandarin Chinese (etc.)? Does it (attempt) to cover all spoken languages? Written?  What about non-vocal languages (finger snaps - all that stuff).  Sign-language?  We now have some evidence that hand gestures are linked to language in the brain...but I digress.  From a simplistic point of view language can be thought of as being three distinct (context sensitive) types of communication: written/read, spoken/heard and performed/viewed.  I suppose an alphabet can't cover the last (but see how choreographers describe dance) and, obviously, there are non-alphabetical languages (pictographics, heiroglyphic, etc.) just as there are languages which make use of whistles, clicks.  SO what does the IPA do?  It just occured to me that maybe the IPA is (now-a-days) only used by euro-centric hobbyists and that would explain why there was no attention given to giving a serious explanation of what it is: ``if you have to ask...{then you don't need to know}```",0.0,0.0029832935560859188
314,"  PS. I was also amused to discover that those trollish users who oppose anything but hyphens include none other than , of recent notoriety.",0.0,0.007142857142857143
315,"  * The article is not quite correct. Decoherence times can range from picoseconds to seconds, depending on the physical system used to implement quantum computer. I think the statement about one nanosecond refers to a different physical system than the one used to build 7 qubit computer. I should go to library, check all the details and rewrite this.   :Error correction can be used to protect against decoherence but was not used in the 7 qubit experiment. ",0.0,0.008676789587852495
316,"`  -  as for the spelling of ``medieval``: The OED reports no recent uses of ``mediaeval``.  Lewis himself had ``medieval`` in the title to ``The Discarded Image`` (as old versions of the page, and other sources, show).  The OED reports nothing distinctively American about ``medieval`` or British about ``mediaeval``, recording uses from both sides of the pond (though the latter, as I said, has no recent uses).   06:05 16 Jul 2003 (UTC)`",0.0,0.004545454545454545
317,Initial content is what I could glean from Japanese article.,0.0,0.0
318,"  I gladly want know what there is so commonly, and I leave that to you.  ",0.0,0.0
319,"  ==Discussion in Manual of Style Japan==   has some strange ideas about you in Wikipedia talk:Manual of Style for Japan-related articles, please correct him.  ",0.0,0.0
320,"  OK well I will drop by and see how things are progressing. Are you interested in Lyndon LaRouche, by the way? I have been having fun there, too.  ",0.0,0.006756756756756757
321,"`  No offense taken as I am certainly not any kind of serious scholar, but a search on ``shortest president`` suggests that many believe Madison was the shortest at 5'4``, so if you know something that is contrary to popular belief, please document it if only for my benefit.`",0.0,0.0
