,Text,oh_label,misspells_count
807,"  == kash jaffrey ==  One of the most prominent Calgary, Canada based financial speculator.One of the most prominent Calgary, Canada based financial speculator.One of the most prominent Calgary, Canada based financial speculator.One of the most prominent Calgary, Canada based financial speculator.One of the most prominent Calgary, Canada based financial speculator.One of the most prominent Calgary, Canada based financial speculator.One of the most prominent Calgary, Canada based financial speculator.One of the most prominent Calgary, Canada based financial speculator.One of the most prominent Calgary, Canada based financial speculator.One of the most prominent Calgary, Canada based financial speculator.One of the most prominent Calgary, Canada based financial speculator.One of the most prominent Calgary, Canada based financial speculator.One of the most prominent Calgary, Canada based financial speculator.One of the most prominent Calgary, Canada based financial speculator.One of the most prominent Calgary, Canada based financial speculator.One of the most prominent Calgary, Canada based financial speculator.One of the most prominent Calgary, Canada based financial speculator.One of the most prominent Calgary, Canada based financial speculator.One of the most prominent Calgary, Canada based financial speculator.One of the most prominent Calgary, Canada based financial speculator.One of the most prominent Calgary, Canada based financial speculator.One of the most prominent Calgary, Canada based financial speculator.One of the most prominent Calgary, Canada based financial speculator.One of the most prominent Calgary, Canada based financial speculator.One of the most prominent Calgary, Canada based financial speculator.One of the most prominent Calgary, Canada based financial speculator.One of the most prominent Calgary, Canada based financial speculator.One of the most prominent Calgary, Canada based financial speculator.One of the most prominent Calgary, Canada based financial speculator.One of the most prominent Calgary, Canada based financial speculator.One of the most prominent Calgary, Canada based financial speculator.One of the most prominent Calgary, Canada based financial speculator.One of the most prominent Calgary, Canada based financial speculator.One of the most prominent Calgary, Canada based financial speculator.One of the most prominent Calgary, Canada based financial speculator.One of the most prominent Calgary, Canada based financial speculator.One of the most prominent Calgary, Canada based financial speculator.One of the most prominent Calgary, Canada based financial speculator.One of the most prominent Calgary, Canada based financial speculator.One of the most prominent Calgary, Canada based financial speculator.One of the most prominent Calgary, Canada based financial speculator.One of the most prominent Calgary, Canada based financial speculator.One of the most prominent Calgary, Canada based financial speculator.One of the most prominent Calgary, Canada based financial speculator.One of the most prominent Calgary, Canada based financial speculator.One of the most prominent Calgary, Canada based financial speculator.One of the most prominent Calgary, Canada based financial speculator.One of the most prominent Calgary, Canada based financial speculator.One of the most prominent Calgary, Canada based financial speculator.One of the most prominent Calgary, Canada based financial speculator.One of the most prominent Calgary, Canada based financial speculator.One of the most prominent Calgary, Canada based financial speculator.One of the most prominent Calgary, Canada based financial speculator.One of the most prominent Calgary, Canada based financial speculator.One of the most prominent Calgary, Canada based financial speculator.One of the most prominent Calgary, Canada based financial speculator.One of the most prominent Calgary, Canada based financial speculator.One of the most prominent Calgary, Canada based financial speculator.One of the most prominent Calgary, Canada based financial speculator.One of the most prominent Calgary, Canada based financial speculator.One of the most prominent Calgary, Canada based financial speculator.One of the most prominent Calgary, Canada based financial speculator.One of the most prominent Calgary, Canada based financial speculator.One of the most prominent Calgary, Canada based financial speculator.One of the most prominent Calgary, Canada based financial speculator.One of the most prominent Calgary, Canada based financial speculator.One of the most prominent Calgary, Canada based financial speculator.One of the most prominent Calgary, Canada based financial speculator.One of the most prominent Calgary, Canada based financial speculator.One of the most prominent Calgary, Canada based financial speculator.One of the most prominent Calgary, Canada based financial speculator.One of the most prominent Calgary, Canada based financial speculator.One of the most prominent Calgary, Canada based financial speculator.One of the most prominent Calgary, Canada based financial speculator.One of the most prominent Calgary, Canada based financial speculator.One of the most prominent Calgary, Canada based financial speculator.One of the most prominent Calgary, Canada based financial speculator.One of the most prominent Calgary, Canada based financial speculator.One of the most prominent Calgary, Canada based financial speculator.One of the most prominent Calgary, Canada based financial speculator.One of the most prominent Calgary, Canada based financial speculator.One of the most prominent Calgary, Canada based financial speculator.One of the most prominent Calgary, Canada based financial speculator.One of the most prominent Calgary, Canada based financial speculator.One of the most prominent Calgary, Canada based financial speculator.One of the most prominent Calgary, Canada based financial speculator.One of the most prominent Calgary, Canada based financial speculator.One of the most prominent Calgary, Canada based financial speculator.One of the most prominent Calgary, Canada based financial speculator.One of the most prominent Calgary, Canada based financial speculator.One of the most prominent Calgary, Canada based financial speculator.One of the most prominent Calgary, Canada based financial speculator.One of the most prominent Calgary, Canada based financial speculator.One of the most prominent Calgary, Canada based financial speculator.One of the most prominent Calgary, Canada based financial speculator.One of the most prominent Calgary, Canada based financial speculator.One of the most prominent Calgary, Canada based financial speculator.One of the most prominent Calgary, Canada based financial speculator.One of the most prominent Calgary, Canada based financial speculator.One of the most prominent Calgary, Canada based financial speculator.One of the most prominent Calgary, Canada based financial speculator.One of the most prominent Calgary, Canada based financial speculator.One of the most prominent Calgary, Canada based financial speculator.One of the most prominent Calgary, Canada based financial speculator.One of the most prominent Calgary, Canada based financial speculator.One of the most prominent Calgary, Canada based financial speculator.One of the most prominent Calgary, Canada based financial speculator.One of the most prominent Calgary, Canada based financial speculator.One of the most prominent Calgary, Canada based financial speculator.One of the most prominent Calgary, Canada based financial speculator.One of the most prominent Calgary, Canada based financial speculator.One of the most prominent Calgary, Canada based financial speculator.One of the most prominent Calgary, Canada based financial speculator.One of the most prominent Calgary, Canada based financial speculator.One of the most prominent Calgary, Canada based financial speculator.One of the most prominent Calgary, Canada based financial speculator.One of the most prominent Calgary, Canada based financial speculator.One of the most prominent Calgary, Canada based financial speculator.One of the most prominent Calgary, Canada based financial speculator.One of the most prominent Calgary, Canada based financial speculator.One of the most prominent Calgary, Canada based financial speculator.One of the most prominent Calgary, Canada based financial speculator.One of the most prominent Calgary, Canada based financial speculator.One of the most prominent Calgary, Canada based financial speculator.One of the most prominent Calgary, Canada based financial speculator.One of the most prominent Calgary, Canada based financial speculator.One of the most prominent Calgary, Canada based financial speculator.One of the most prominent Calgary, Canada based financial speculator.One of the most prominent Calgary, Canada based financial speculator.One of the most prominent Calgary, Canada based financial speculator.One of the most prominent Calgary, Canada based financial speculator.One of the most prominent Calgary, Canada based financial speculator.One of the most prominent Calgary, Canada based financial speculator.One of the most prominent Calgary, Canada based financial speculator.One of the most prominent Calgary, Canada based financial speculator.One of the most prominent Calgary, Canada based financial speculator.One of the most prominent Calgary, Canada based financial speculator.One of the most prominent Calgary, Canada based financial speculator.One of the most prominent Calgary, Canada based financial speculator.One of the most prominent Calgary, Canada based financial speculator.One of the most prominent Calgary, Canada based financial speculator.One of the most prominent Calgary, Canada based financial speculator.One of the most prominent Calgary, Canada based financial speculator.One of the most prominent Calgary, Canada based financial speculator.One of the most pr",0.0,0.00020048115477145148
808,"  == KASH JAFFREY ==  ADD KASH JAFFREY, DO YOU HAVE BIAS AGAINST CANADIANS?",0.0,0.05333333333333334
809,"  == FUCK YOU THUE ==  YOU BRAIN DEAD FUCK, YOU CAN'T BLOCK ME. THANKS TO PROXY SERVERS AND ANON BROWSING I CAN COME TO WIKI ZILLION TIMES SO IF SCUM LIKE YOU THINK THAT YOU CAN BLOCK ME THEN YOU ARE IN FOR BIG SURPRISE YOU FAGGOT. I AM GIVING YOU LAST CHANCE IN CIVILIZED WAY TO STOP VANDALIZING KASH JAFFREY. DON'T FUCK WITH CANADIAN CONTENT, ITS TO ADVANCE FOR YOUR EMPTY BRAIN TO CONCIEVE. AND LASTLY IF YOU WANT TO LEAVE MESSAGE THEN WRITE (DON'T USE PREDEFINE ONE LINERS.) SEE YA ASSHOLE  JOEY",1.0,0.008016032064128256
810,"`  *********************************  Josif Stalin IS one of the three worst criminals in the history of mankind, the other two being Hitler and Mao. Mao killed 38 million human beings, Stalin at least 25 million and Hitler at least 20 million. The figures are there on the CIA website. It is unacceptable to show Stalin and Mao as politicians on Wikipedia website when Hitler is depicted as a monster. All of them were equally monsters and the personal cult communism was no differenct from nazism in essence.  You need to be aware that most former eastern bloc countries banned the use and display of the five-pointed red star and the hammer and sickle symbols of communism alongside the swastika and some local fascist sysmbols, because they know from personal experience that the horrors of stalinism were no less than that of nazism. The hungarian law banning all these is the XLV. (45th) law of 1993, titled ``Az önkényuralmi jelképek használatát tiltó törvény`` and it has been upheld in constitutional court.  If you fail to mention the very criminality of Stalin and Mao in the very header of their wiki articles, then you are looking for an edit war, period. We, the people of ex-soviet bloc countries are personally insulted when anglo-saxons pet ``Uncle Joe`` as the kind old leader. Be glad he did not rule you (you may not have been born then with 10% probability because your father would get executed or die in the Gulags beforehand, no kidding). Acknowledge our sufferings by stating the truth: Stalin was one of the three worst criminals in the history of mankind, period.  Regards: Tamas Feher from Hungary (etomcat@freemail.hu)`",0.0,0.013349514563106795
811,"`  You are Stalin apologets. Where is placed the mention of Katyin massacre, where several thousands of polish POVs were shot by NKVD upon Stalin's personal order? We hugarians are very close brothers of the polish people historically, so I find the lack of proper and emphasized mention of Katyin very painful. Stalin's crimes against Poland are amongst the most outrageous in written history. There is no excuse to the Molotov-Rippentropp pact. Make no mistake that was the Hitler-Stalin pact.  I really wish Stalin ruled you, not us. You are like Rumsfeld, who met Saddam during mid-1980s and praised him as a good ally in the anti-Khomeini Iran war. When will you realize that Putyin's current rule is an analog of Stalin's, characterized by extreme disregard for law, anti-semitism (most notably the early 50's doctor trials vs. 2004's Khodorkovski-Yukos) and imperialism (brutal military actions in the Caucasian Mountains both times and desire to the rule neighbours). Thus, by not mentioning Stalins criminality in unambigious terms, you hold the english-speaking world blind to Putyin's methods and you contribute to a ``new Uncle Joe`` sentiment, which will inevitable put the world and the poor Russian race in great danger. A repetition of history for those who refuse to learn about the past.  Stalin started his reign with a few million dead, by reversing Lenin's post-civil-war ``new economic policy`` of limited private agriculture thus leading to big famine.  The entire WWII in Europe would be over in 6-9 months had Stalin failed to entirely decapitate the soviet army's elite in 1937-39, this is clearly written in vol. 2. of soviet published seven-volume ``The history of the Great Patriotic War 1941-1945``. You are plain stupid to praise Stalin for a ``hard earned victory in WWII``.  So powerful was the fear of Stalin's evil power, that even us hungarians, who previously fought three revolutions and independence wars in the last 300 years, did not dare to raise again until autumn 1956 to free ourselves from stalinism. Anglo-saxons betrayed us big time then, shame on the Free World.  In churches renovated after WWII (big destruction in Hungary) the face of the Satan (as defeated by arch-angel Michael) is always of Josif Stalin's on wall paintings. People were shot for painting that.  Regards: Tamas Feher.`",0.0,0.00897819581017529
812,"  ==A New Record==  Two articles riddled with plagiarized information, protected for over three weeks! I think that sets a new record, one that you can be proud of.  ",0.0,0.0
813,"`  :: Hey, the only persons ``suffering`` were those who read that bullshit, Wikipedia opening itself up to a Copyright infringement suit, and the credibility of those who are facilitating both.  The length of the protections will not influence my decision to revert the article back to a previous version that does not contain plagiarism.  `",0.0,0.0
814,  ::It's a done deal:  —  ,0.0,0.0
815,"  :There is no such thing as anarchist rule. The factory occupations and councils are of interest to anarchists as being non-hierarchal, directly democratic forms of large scale organization. The article is not saying that the State and capitalism have been totally abolished.  ",0.0,0.0
816,"  Your comments are strange, arrogant and not related to my revert. What I removed was large swats of political, unreferenced statements. The onus is upon the original writer to provide references for his or her claims. Until that is done, disputed claims will be gone.  ",0.0,0.0036900369003690036
817,"  ::: Hey Bobby, get a clue, I dont deal with tards or liars.  ",1.0,0.031746031746031744
818,"  Weight sounds fishy  >Mk-54 weighed 68 kilograms  Sixty-eight kilograms is the weight of an average non-obese adult male person. That means 68 kilograms is definitely not man-portable, not even by two soldiers carrying it. Maybe you meant 68 pounds (some 32 kilogramns)?",0.0,0.003676470588235294
819,"  This issue, including the sources, was covered in the talk pages between myself and another user almost a year ago. I stand by my statement that if a user is too damn lazy to go to the talk archives and find it, then that is too bad for them.  ",0.0,0.0
820,Quit vandalizing the pages or you will be blocked.- ,0.0,0.0
821,"  ==French baroque composers== Hello, I am Gérard and i read your to-do list. I am specialized in french baroque music - particularly for harpsichord and organ. I have written quite a lot of bios of french baroque composers for the french Wiki and my purpose is to translate them to english. Ot will be necessary to check them, because english is not my mother language, as you probably will notice. Could you help me ? Thanks. Gérard ",0.0,0.006896551724137931
822," (various mss, different dates)",0.0,0.03225806451612903
823,"  Someone has re-instated the link to the petition. This petition is to change the flag; it is promoting a particular point-of-view. Unless a link to a petition for keeping the current flag is added then the Wikipedia NPOV rule is broken. Please insert a link to such a petition (if one exists), otherwise I suggest you remove the current link. ",0.0,0.002898550724637681
824,"   == Ross Perot and the Reform Party ==  I edited to include Ross Perot because his candidacy everywhere was talked about as appealing to the 'radical middle' (in the press even). He said he was a social moderate and fiscal conservative, but his general tone was of centrismwhich is why for years after 'swing voters'/centrist voters/independents were called 'Perot voters'. On most issues he came to compromises between Democrats and Republicans with hard solutions. For instance he said both tax cuts and tax increases were needed. He also felt that partisanship and gridlock between the parties caused most problems, including incessant debates on social issues like abortion. But he promoted issues that appealed to the center (that weren't just plain 'centrist' but pro-active positions that at that time hadn't been talked about much before) like balanced budgets, campaign finance reform, referendums, term limits, etc.  The Reform Party was based on this platform and was radically centristmembers even called themselves 'centrist'. People in the party felt there were definite issues that needed to be solved, and the two major parties had to be challenged to solve them, with the creation of a new party. Today, many might say the party has a chink in this line of thought, because after Pat Buchanan and his supporters entered the party in the 2000 election, hard stances on immigration started to enter party platforms.  Which is somewhat right-but even still it doesn't compromise on the idea. I read Noam Chomsky once wrote that in America the groups on the fringes of politicslike Nader on the left, Buchanan on the right, and Perot in the center, agreed substantially on their significant issuesand he proposed that they joined together in a pretzel to form the 'radical middle'. A radical 'centrist' is an uneasy concept, since politics always changes and what will be moderate will change. The idea here though is that there is a growing set of issues that is not shared by left or right parties (fair trade, campaign finance reform, balanced budgets). That those who support these issues also carry different baggage of their own, tied to left-right positions, like Buchanan with abortion or immigration, should be expected.  If you're talking about John McCain, he plays to many of these positions (but is still free trade). But he's usually still what you might call a 'sensible' centrist and usually falls on the right, where he is. I was in the Reform Party (i think my analysis is accurate so don't bring up the bias), and many members hated McCain because he was a 'false reformer'-for instance his McCain-Feingold act made it even harder for third parties, while not doing anything substantial for reform. The sentiment was that he was just taking advantage of the issues for his public image. If you even listen to his speeches on reform he gives no substance just uses the phrase 'special interests' liberally.  From what I know about UK politics, Tony Blair looks more like Clintonesque centrism (which is purely political) than anything else.   ",0.0,0.0022756827048114434
825,"  Trivia just removed from article. It was right to remove it but maybe it can be added in again some time in future if it can be made relevant:  :''Ten Australian Prime Ministers (Barton, Reid, Cook, Bruce, Page, Menzies, Fadden, McEwen, Gorton and McMahon) have been freemasons.   ",0.0,0.01060070671378092
826, that will substantiate your claim that the Iraq Liberation Act was a violation of international law,0.0,0.0
827,"    I realize that several people (apparently including Rama) have attempted to point to Israel's bombing of Osiraq as the catalyst for Iraq's nuclear program, but it just does not hold up to scrutiny. Iraqi defectors as well as the IAEA's post Gulf War investigations found that Iraq had a clandestine program dating back to the late 1970's.   Most of Iraq's nuclear work was done at Al Tuwaitha. Although the IAEA had access to Al Tuwaitha, it was extremely limited with the majority of the complex off limits to IAEA inspectors because no “declared nuclear activity” was taking place there. Evidently Blix saw nothing wrong with this.  For the section quoting (although I did not include the quote to avoid POV) Blix praising Iraq compliance on the eve of the Invasion of Kuwait and during the beginning of Iraq's crash bomb program: NuclearFuel, August 20, 1990",0.0,0.008092485549132947
828,  ::::: Application of the UN Charter to the Iraq Liberation Act is original research.  ,0.0,0.0
829,"  :I am just interested in contributing to a subject in which I have accurate, detailed, and correct information. If you like to paint a rosy and romantic picutre of Bahaism, and certain facts ruin this picture for you, don't blame those who state the facts. In other words, don't shoot the messenger. I am simply stating some facts. Also, going to multiple people's personal pages and knocking on every door trying to portray me as some sort of evil character just because I have contributed FACTS AND CORRECT INFORMATION to Bahai-related articles, is not a good idea, there are good chances that it will backfire on you. Is there any misinformation that I included in any of the articles?  Is the picture that I uploaded not authentic?  What is your problem with my contributions other than the fact that I do not have a long list of variegated contributions?  ",0.0,0.0011587485515643105
830,"  That would be a good idea, this way I could check to see if Anon is placing more cw material into the article. But I would have to insist that all current info be erased due to all the cw violations.  ",0.0,0.0
831,"  ::Until you can give me, a person who worked on Bob Dole's campaign, a citation for your claim, I will assume that this is fiction.- ",0.0,0.0
832,"As I indicated on the other talk page for the election, I will take down any thing I want to from my our talk page, whenever I choose toespecially if the material that I remove is abusive.   ",0.0,0.005235602094240838
833,"  == Triggerhappiness == Hello.  Congratulations on your Adminship.  I know that most people who become Admins like to display good administrator qualities to their peers, and this can, at times, result in triggerhappiness.  I believe your quick page protection reaction on the Bahá'í Faith page is one such case.  Please unprotect the page, so that I can incorporate both the new contributions of the other guy as well as include the photo of the prophet of that religion in the article.  Thanks.   ",0.0,0.01
834,"  ::OK, will do.  Thanks for unprotecting it.  I will try to reason with them in the discussion page.  It seems they are a group and they think Wikipedia was created as a medium for promotion of Bahaism.  But anyway, we'll work it out somehow.  Thanks.   ",0.0,0.00392156862745098
835,"`  ``made famous for the second voyage she made with Charles Darwin aboard.`` Does this mean that it was the second voyage with Charles Darwin, or it's second voyage total? Ambiguous!`",0.0,0.0
836,"  HELLO! HELLO! I would expect a bit more harsh treatment for this drink which single-handedly ruined the largest country in the world! You are mostly praising it (purest, this good, that good, no hangover) instead of condemning it in strong terms. Vodka is easily the biggest curse ever seen in history, it makes people drink their brains away and halts all progress or human effort. Why there is no mention of Gorbachev trying to ban it and how the USSR fell apart?",0.0,0.0021413276231263384
