,Text,oh_label,misspells_count
0,"`- This is not ``creative``.  Those are the dictionary definitions of the terms ``insurance`` and ``ensurance`` as properly applied to ``destruction``.  If you don't understand that, fine, legitimate criticism, I'll write up ``three man cell`` and ``bounty hunter`` and then it will be easy to understand why ``ensured`` and ``insured`` are different - and why both differ from ``assured``.  The sentence you quote is absolutely neutral.  You just aren't familiar with the underlying theory of strike-back (e.g. submarines as employed in nuclear warfare) guiding the insurance, nor likely the three man cell structure that kept the IRA from being broken by the British.  If that's my fault, fine, I can fix that to explain.  But ther'es nothing ``personal`` or ``creative`` about it.  I'm tired of arguing with you.  Re: the other article, ``multi-party`` turns up plenty, and there is more use of ``mutually`` than ``mutual``.  If I were to apply your standard I'd be moving ``Mutual Assured Destruction`` to ``talk`` for not appealing to a Reagan voter's biases about its effectiveness, and for dropping the ``ly``.  There is a double standard in your edits.  If it comes from some US history book, like ``peace movement`` or 'M.A.D.' as defined in 1950, you like it, even if the definition is totally useless in 2002 and only of historical interest.    If it makes any even-obvious connection or implication from the language chosen in multiple profession-specific terms, you consider it somehow non-neutral...  Gandhi thinks ``eye for an eye`` describes riots, death penalty, and war all at once, but you don't.  What do you know that Gandhi doesn't?  Guess what:  reality is not neutral.  Current use of terms is slightly more controversial.  Neutrality requires negotiation, and some willingness to learn.  This is your problem not mine.  You may dislike the writing, fine, that can be fixed.  But disregarding fundamental axioms of philosphy with names that recur in multiple phrases, or failing to make critical distinctions like 'insurance' versus 'assurance' versus 'ensurance' (which are made in one quote by an Air Force general in an in-context quote), is just a disservice to the reader.  If someone comes here to research a topic like MAD, they want some context, beyond history.  If this is a history book, fine, it's a history book.  But that wasn't what it was claimed to be... `",0.0,0.0020859407592824365
1,"`  :: the term ``standard model`` is itself less NPOV than I think we'd prefer...  :: if it's ``new-age speak`` then a lot of old-age people speak it - Karl Popper, the Pope, etc.  here's Karl Popper's view of this.  :: The clearest title for this article would be ``particle physics cosmology`` - but as I say that would require broader treatment of issues like the Anthropic Principle, cognitive bias beyond the particle physics zoo, etc.  :: as to accelerators, it's clear that while they are in use, someone is still looking for particles.  So this is not yet a settled ``cosmology`` so certain that we abandon the search... nor is it an arbitrary foundation ontology as you suggest, not subject to question.`",0.0,0.001402524544179523
2,"  True or false, the situation as of March 2002 was such:  A Saudi proposal of Land for Peace AND recognition by ALL arab countries was made. The day the proposal was to be made formal by the Arab League was the day the Israeli's under the command of Ariel Sharon began the invasion of the Palestinian self-rule areas. user:Arab.",0.0,0.00303951367781155
3," Next, maybe you could work on being less condescending with your suggestions about reading the naming conventions and FDL, both of which I read quite a while ago, thanks. I really liked the bit where you were explaining why you had no interest in fixing things I complained about because you felt insulted, yet you were being extremely insulting at the time. With any luck, you can learn to be less of a jerk. GregLindahl       ",0.0,0.004662004662004662
4,This page will need disambiguation. ,0.0,0.0
5, -  Important note for all sysops: There is a bug in the administrative move feature that truncates the moved history and changes the edit times.  Please do not use this feature until this bug is fixed. More information can be found in the talk of  and . Thank you. ,0.0,0.0
6,I removed the following:  All names of early Polish rulers are ficticious and therefore this index naming Oda von Haldensleben and her husband Dagome records for the first time rulers of the Polanen tribe. Therefore it is indicated as being the first document of the later developing land named Poland.  This is quite a comment. All names are fictitious? It deserves at least some backing. ,0.0,0.015384615384615385
7,"`:If you ever claimed in a Judaic studies program that ultra-Orthodox Jews don't have rabbis, or don't have synagogues, you would be laughed out of the room.   ::I am beginning to see the problem you have. You see, you do not know how to read what other people say without attaching your personal bias to it. Never once did I say that ultra-Orthodox Jews have no rabbis or synagogues. I DID say that the role of the rabbi and synagogue in ultra-Orthodox Judaism is minimal when compared with, say, Conservative Judaism. They are not clergy, in the traditional Western sense of the word. That is a fact. As for synagogues, they exist, but they are not essential. Minyan (a quorum of ten adult males in ultra-Orthodox law) is essential. You can have a minyan without a synagogue, but a synagogue without a minyan is an empty building. You can laugh all you want, but it doesnt change the facts. It may seem strange to you, but take the statement to anyone who actually knows something. I want to know who laughs then.   :If you ever claimed in a recognized Judaica studies program that a significant number of ultra-Orthodox rabbis accept and follow Modern Orthodox responsa (instead of their own), people would look at you as if you had two heads.   ::Also a silly point. If you were to draw such sharp distinctions between ultra-Orthodox and Modern Orthodox Judaism in a recognized Judaic Studies program, they would not know what you are talking about. A) That statement is false, because responsa in Orthodoxy does not work on the basis of someone's synagogue affiliation. B) What is a Modern Orthodox responsa versus an ultra-Orthodox responsa? C) In cases where things like hashgacha (kosher certification, etc.) are debated, you will find in most cases that it is not a question of responsa. If you know something about responsa literature in general (which apparently you do not), there are degrees of acceptance. For example, halav yisrael (milk under rabbinical supervision during milking to ensure that it comes from a cow). Most modern-Orthodox Jews do not insist on it t on the basis of a responsa by Rabbi Moshe Feinstein who determined that American government supervision is sufficient. Most ultra-Orthodox Jews do insist on it. They do not reject the responsa. In fact, Moshe Feinstein (Reb Moshe, as he was called) was considered the leading halachic authority for the American ultra-Orthodox community in the past fifty years. They will say that the ruling is right BUT they want to be machmir (more strict on themselves, meaning more pious). It is not a rejection. It is simply being stricter. Ovadya Yoseph said women could wear pants instead of skirts. Would any of his daughters or daughters-in-law be caught dead in pants? No way. They are machmir.   :You just can't make this stuff up, Danny.   ::I dunno. I seem to be giving answers to everything you say, and my answers are based on sources. I am not making things up. I am simply stating things that (no matter how inconceivable it may be) you do not know.   :Stop trying to re-make the ultra-Orthodox in your own image. Its not good history. Frankly, I don't care what is on your resume. It doesn't justify writing such nonsense.  RK  : Personal attacks. I will say that your intellectual arrogance coupled with your apparent ignorance do not put you in a very good light.   In my professional life, I have researched and written extensively on this field, developed relationships  both working and personal  with many of the people involved, and worked on several important documentary films on the topic. I think I have a sense of what NPOV is, and a statement that the ultra-Orthodox ``hate`` the non-ultra-Orthodox just doesn't make the mark.   : Is beating the shit out of non-Orthodox Jews an act of love? Is calling them ``worse than Hitler`` an act of love? Is accusing them of creating the Holocaust an act of tolerance? Danny, you can protest all you like, but you obviously so immersed in an ultra-Orthodox worldview that you can't see the forest for the trees. This is violent hatespeech, and it frightens me to see an educuated person making apologetics for it. RK  :: Then it must frighten you even more knowing that I was actually there (and on one occasion, actually hit). Why? Because I do not feel the same antagonism that you do? Because I see some distasteful remarks in a certain context? You say in your diatribe that you want everyone to sit together and sing a Shlomo Carlebach niggun. Just answer me this though? Would Reb Shloime have davened in a shul without a mehitza?   Oh, and haredi does not mean ``trembling,`` as you originally wrote at the top of the article. In fact, that was kind of funny. You were apparently confused with the film Trembling Before God, which ",0.0,0.007537688442211055
8,"   My apologies  I'm English, I watch cricket, I know nothing. Maybe I was thinking of the time he spent in the Army, or maybe I was thinking of Elvis, or something. I'm glad the page got improved. ",0.0,0.0
9,"`Someone wrote: More recognizable, perhaps, is a type of what is generally called rock and roll called [folk rock]? or simply ``folk,`` which included performers such as [Joan Baez]?, Bob Dylan, Simon and Garfunkel, [The Mamas and the Papas]?, and many others.   I've tried to clarify this. ``Folk rock`` is used very specifically and is typically far more recognised by instrumentation than form. Many folk musicians of the 60s (Tom Paxton, Phil Ochs etc) sang new, topical material (which distinguished them from traditional folk musicians) but in the folk idiom (acoustic instruments, traditional arrangements and often traditional melodies.)  Re: the comment about ``marketers`` in the first paragraph. If language reflects common usage, what is now called ``folk music`` has as much right to the name as any other form. Gareth Owen  To the latter: fair enough, but does the first paragraph actually imply otherwise? LMS  I like the page in general but wonder if the following is unnecessarily cynical (implying, as it does, a financial rather than artistic incentive to change musical styles): :``Some of these performers, of which Joan Baez is an excellent example, began their commercial music careers performing traditional music in a traditional idiom, but soon transformed their style and accompaniment to suit popular tastes.``  Ya know, I agree, but I don't know how to change it right off. Anyone else want to give it a stab? LMS  The deletions are merely of things that seemed redundant. Additions may solve the problem of tone mentioned above. One bit of the original puzzles me, so I corrected the grammar but left it inbut what does ``unrecognizable to its source`` actually mean?  I like the new additionslots of good new information here. I added some more. The problem now is that the article is rambling and disorganized, and I am probably not the best person to organize and clarify it. BTW, using the word ``purist,`` without the quotes, makes it sound as if the authors of the article are not purists, which we don't want to imply. -) See neutral point of view. LMS  Perhaps someone who knows the facts -) could add in ``Skiffle`` music, from whence the Beatles sprang, which was evidently a British folk form in the 1950's.  Certainly the Beatles stole (er, utilised!) many folk forms in their music. `",0.0,0.0034379028792436614
10,"  :Correct. Full biographical details will put down his birth details, etc. It is just a marker to me at the moment to detail the WR aspect. He certainly wasn't Belarus; as a geo-political entity it had no real existence at the time. I have put a tbc marker on this article for now. ",0.0,0.01060070671378092
11,`  Care should be taken to distinguish when and if definitions of ``express`` and ``special delivery`` stamps are written that while in many countries the definition is the same in the United States there is a definite difference between ``Express Mail`` and the (now defunct) ``Special Delivery.`` `,0.0,0.0
12,"  :If I may butt in  I've spent the last 1/4 hour following Andre, and I think he needs reining in. I left him a note at the deletion log, with a stern warning.  13:14 Aug 14, 2002 (PDT)",0.0,0.0
13,   On my  you will find the apology that I owe you.  [ shuffles his feet and looks at the floor],0.0,0.0
14,"`  :<>>  :I fail to see the distinction.  Who better than legal scholars to define what the law is?  Moreover, my comments in re how legal scholars define the law were a response to your dubious assertion that law qua law can be defined as a ``decision process.``  That assertion has no place in the main law article.  :<>  :I disagree.  The enactment of a statute falls under the topic of legislation.  :<>  :These issues are not law qua law; they are topics which should be discussed under the ambit of particular legal topics, such as ``statutory interpretation`` or ``contracts,`` or related topics, such as ``sociology`` and ``political science.``  :<>  :Law qua law is first and foremost a body of knowledge:  The academic field to which you refer is the study of that body of knowledge, and should be considered as part and parcel of the discussion found in the main law article; the profession of law is the application of that body of knowledge, which should be discussed in the ``practice of law`` article.`",0.0,0.0
15,gets far more tendentious yet. ,0.0,0.0
16,"`  As a person who has done some of this activity, I say we use ``bioprospecting``. That is the word I've always used and heard. ``Bioprospection`` seems a bit pedantic to my ears. `",0.0,0.01098901098901099
17,"It's great that we've found a new source of free information here, but these articles are obviously written for a turn-of-the-century Christian audienceand are, hence, of course, totally biased.  But Wikipedia articles are supposed to be written from the NeutralPointOfView.  I'm not sure what to do here, but if I were you, o anonymous uploader, I would stop uploading these articles and start editing the ones you've uploaded so that they are unbiased (or much less biased). LMS  ",0.0,0.008298755186721992
18,"    :No, I really haven't heard of either one, at least not that I recall. I've heard of extreme positions, usually in a dismissive and ironic way, but don't really know their details. They really are on the fringe and not held by the majority of feminists. I've been involved with several feminist groups, usually working on local issues, but I am by no means a feminist scholar. I only have a general knowledge about feminism and especially how it is practice within NOW, of which I am a member. I don't follow the literature, for example.    I am truly committed to maintaining a npov, and I hope you are too. I'm not convinced of that, though. Please consider making an attempt to carefully state that the beliefs of certain subgroups of feminism are not necessarily beliefs feminists as a whole agree on. Readers will make their own judgement about which beliefs they buy and which they don't. It isn't up to us to steer them one way or another. And have a Happy Holiday! Dmerrill    ",0.0,0.003033367037411527
19,"  I'd like the concepts of microevolution and macroevolution better related to the debate over evolution. Moreover, I think they are best used as terms that define the debate, rather than concepts in themselves to be disputed.    The theory of evolution, if it is indeed scientifically sound (and almost no one here doubts that), should be able to stand on its own merits without you all feeling you must defend it at every point.    The various articles which present alternatives to evolution, however outlandish or zany they seem to you scienntists, require merely a link or two each to the accepted science.      Ed Poor  ",0.0,0.004792332268370607
20,"    I agree, the first one is simply wrong, and the other two are already covered. And I also agree that we have to start getting serious about the math. forumulation -) AxelBoldt",0.0,0.0111731843575419
21,"    Yep, that's Twin cities from which this article originated.",0.0,0.0
22,"`      That's another relevant empirical question: if there really are millions of people who would be horribly offended by ``Christian mythology``, then perhaps it's justifiable to avoid the term even if it's otherwise a good term.  But if it's just a few oversensitive ninnies, and most reasonable people can come to accept the non-pejoritive use of the term if it's explained, then I see no reason to avoid it.  I rather like ``Scientific mythology`` personally, and wish it were restored.  LDC    `",0.0,0.00199203187250996
23,    : This sounds right. Historians speak of these people at these times as Jews practiving Judaism. The rabbinic/pharisaic Judaism that was canonized in the Mishna (about 200 CE) is a compilation of teachings from about 200 years before the time of Jesus to about 150 years after. RK,0.0,0.01056338028169014
24,"    Ummm. The article uses imperial measurements, not SI ones. Some translation is apparently in order. -) Anders Törlind",0.0,0.024793388429752067
25, See? I was right! ;-)    ,0.0,0.0
26,"  :I have checked the licenses, and it is public domain without restrictions. See http://www.tuxedo.org/~esr/jargon/html/index.html ",0.0,0.03787878787878788
27,"` Changed Macedonia link to Macedon; ancients didn't call their land Macedonia, and the entry we have on ``Macedonia`` isn't useful for Alexander. Should probably have an article on Macedon, and take the one sentence about Alexander out of Macedonia, maybe with a ``see also.``   I don't particularly have a problem with Macedon/Macedonia, but don't the naming conventions suggest that articles be named based on their most popular usage, rather than their most correct usage (if there's a difference)?  Perhaps using Macedonia to refer to recent history and Macedon for ancient history would work (with ``see also`` back and forth)?  Blain   My native language is Greek and I can assure you that Macedon and Macedonia is the same thing. Macedonia is the ``modern`` way to say Macedon. Maybe you should change back the link to Macedonia from Macedon. If the article about Macedonia is not informative enough you could always change it.   Just a note about the relationship between Aristotle and Alexander. Those two were two different personalities and they used to clash a lot but Alexander did something that makes me wanter if their relationship was as bad as people think today. While he was invading Asia he would send to his teacher all new and interesting animals that he would incounter in his expedition because he knew that old Aristotle was almost obsessed with the classification of things. The result was that Aristotle formed a kind of a zoo back in Macedonia from the gifts of his student. Now, if young Alexander was so sick of his teacher why did he bother?    Good point.  I think Alexander was complicated enough that trying to determine who he liked and who he didn't (and which was safer) isn't all that easy.  He was known to treat his enemies rather well and to kill his friends when they ticked him off.  I think he might have respected Aristotle and just not wanted to spend time around him anymore.  Just a thought  Blain   The most recent edits to this article are very strange. Why change Egypt to ``Pgypt``??  Why delete the paragraphs that were deleted? Can someone give me a reality check on this? `",0.0,0.0014084507042253522
28,"`   :Incidentally, re naming conventions: the only convention I know of that would be relevent here is Wikipedia:Naming conventions (common names), which states ``Use the most common name of a person or thing that does not conflict with the names of other people or things.```",0.0,0.0036231884057971015
29,"`I removed ``from scratch``. In addition to your reasons, it just looks better without it.  02:04 Oct 14, 2002 (UTC)  `",0.0,0.0
30,"  ::I disagree. I would leave it out of the introductory part, since its population (which changes every census) is not nearly as fundamental as the fact that it is in a particular state, its county seat is whatever it is, andstuff like that. Also, if Wikipedia survives till 2010, someone will have to be careful to change it in both places!  BRG  ",0.0,0.0057306590257879654
31,"`  :::: You're onto something important, there. Even the liturgical renewal movement seems to have aesthetics and drama at the center of why traditional forms need to be recovered.  From bible-belt Passion plays to [ Hell House ], there is a definite tie-in with theater in modern ideas of ``church``.  I've visited evangelical churches that have nothing recognizably churchy about them - pure entertainment (movies, football games, mime, concerts, just about anything but rites or sermons) - and it's quite intentional; and I've heard that similar things are happening in trendy Roman catholic churches although I have no experience with that.  Personally, it's repugnant. But, it is fact that this is happening and, it's not a fringe phenomenon. `",0.0,0.0
32,"`I posted this to  because the timeline confused me too.  Hey, I tried to clean up the timeline at Vote so it was easier to read and realized I don't know what it's a timeline of. What does it mean when you include the qualifier ``to stand for elections?`` Does that mean in addition to the right to vote? What if the qualifier says ``right to vote``? Also, what is your source? Myanmar was called Burma in 1935, and the FYR of Macedonia did not exist in 1946. I'm pretty sure Croatia, Uzbekistan, Krygyrztan and Kazakhstan did not exist at the time they're on your list as well. What are you referring to? The US is on in 1920, so you're obviously not referring to universal suffrage. You need to explain exactly what this list is talking about, because I had assumed it was universal suffrage.  A timeline of the development of voting would be interesting (though it should probably be a separate article), but it needs to be clear at which stages the right was granted to which people (based on sex, race, age, criminal history, political status, etc).  19:26 Oct 21, 2002 (UTC)  `",0.0,0.0018450184501845018
33,"  :::I don't know where you got the idea that Mt. Airy's in 4 counties. It's only in two. Were you the one, Tokerboy, who added two counties to the two I'd listed when I put it into the Frederick County article?  BRG 10/22",0.0,0.013513513513513514
34,`    Thanks for fixing the spelling error in ``propaganda``.  I can't believe I did that.  `,0.0,0.0
35,"  Ezra, you have got to be kidding with this page. You are taking one of many interpretations of Judaism and giving it sole legitimacy, often with simple rhetorical claims. Even within Orthodox circles many of the views you express are controversial at best (and often considered shtus). Please fix it up or I will do it myself, and I do know my stuff. ",0.0,0.0028328611898017
36,"`  ::::: There's nothing particularly objectionable about this to me - however, how ``rough`` is the equivalence?  It seems to me that even on a Septuagint-centric view of the Old Testament, it matters that one believes the Septuagint is the Old Testament of Christianity when there is a difference on some point (and only then IMO).  In those cases, it can be pointed out as emphatically as one would like, that ``the Old Testament of Jesus and of the Apostles, was the Greek Septuagint; and the reason that matters in this case is because the Septuagint was translated to say yada-yada, whereas the Hebrew version is more ambiguous.``   `",0.0,0.003125
37,"`  ::: Pointing out which word is used less than others seems unnecessary. It's not a competition. Each should be a stand alone article, each should be linked to and from the ``discrediting tactic`` article, and each should have basically the exact same wording (if they exist at all).   :::Besides, it would be hard to prove which one is used less. People that hate Bush will hear ``Bushism`` more, people that hate Gore will hear ``goreism`` more. If we surveyed the Wikipedia family, I think we'd hear from our fair share of both groups. -jazz77`",0.0,0.0036429872495446266
38,  :::Yet more:  Follow the whole thread if you like. mav,0.0,0.017857142857142856
39,"  :Re: your question about Nieuwpoort. You are right that 'Nieuwpoort' could be translated as 'Newport'. However, I have never seen the city translated as such in English. Some Belgian cities are translated in other languages, others not. I suspect Nieuwpoort is not, and therefore needs not to be disambiguated (but I'm not 100% sure).  19:14 Dec 4, 2002 (UTC)",0.0,0.008310249307479225
40,"  Hi Alex  Just thought I ought to mention that not ALL self-links are unwanted - you removed one in List of musical topics that was wanted and its presence was requested on the Talk page. I think there are a few in maths topics which make this clear - something to do with keeping an eye on updates? It's not clear to me how this whole issue works (in fact I thought I'd raise it in the village pump) some time, but thought I should mention it to you anway. Regards  11:33 Dec 26, 2002 (UTC)",0.0,0.0040650406504065045
